"Position","Job Title","Company","Location","Salary","Short Description","Posted At","Job link"
46,"Data Scientist - MCTO","II Corps Consultants, Inc.","Hybrid work in Alexandria, VA 22311","Up to $110,000 a year","Apply data mining, data modeling, natural language processing, and machine learning to extract and analyze information from large structured and unstructured…",,"https://www.indeed.com/rc/clk?jk=87a9ed6eda09634d&bb=1njvimLpOGD6kBusRFqbmlWyqayc0XHY6rm9X7mmwpWq2FDxxRGrj1gIGzLl92WjieGUS0syHids61g3_BwobbWt4hNkMef8fAojYLkGFP5belvWg0q8RmxpHQi9xPMV&xkcb=SoAL67M39QgCmly2A50LbzkdCdPP&fccid=c803853a29c3a5ce&cmp=IICORPS-Consultants-INC&ti=Data+Scientist&vjs=3"
47,"Data Scientist","SVB Capital","Hybrid work in Menlo Park, CA",,"Mission - is to develop and manage a curated data & analytics platform that provides intelligence and drives efficiency to SVB Capital.",,"https://www.indeed.com/rc/clk?jk=025fcaf2e44994a5&bb=1njvimLpOGD6kBusRFqbmsoVGNvGnUnQagq3fi0wfRz-0sX87u28HVb23pK6lZ0cTQ-X6zGjMR8lXXadUOMnG5zT-e-TbDHkLfPmUhL5oirrlktev0zYYq59LU02fBXE&xkcb=SoC_67M39QgCmly2A50KbzkdCdPP&fccid=a8ba95482d384215&vjs=3"
48,"Senior Data Scientist","Verikai Inc.","Washington, DC","$154,000 - $174,000 a year","Work closely with other data scientists, engineers, product managers, and other stakeholders to integrate machine learning models and statistical analyses into…",,"https://www.indeed.com/rc/clk?jk=4e620a532e9a787f&bb=1njvimLpOGD6kBusRFqbmqHobpZPxpr6csprWBJyQGvL-FJjYzy1ZbnhZW3wcj0Uu5mwI8s2BHsqSkt5tkNW1we49F_i7QAxANDIQUgOaryyl3PrvzZEyQ%3D%3D&xkcb=SoAi67M39QgCmly2A50JbzkdCdPP&fccid=34ad38177401e71c&vjs=3"
49,"DATA SCIENTIST I","U.S. Xpress Enterprises, Inc.","Remote in Chattanooga, TN",,"Conduct exploratory data analysis to identify patterns, trends, and insights.
Familiarity with data visualization tools.
Experience with Git and/or bitbucket.",,"https://www.indeed.com/rc/clk?jk=2d5bf8c455bbd092&bb=1njvimLpOGD6kBusRFqbmsoVGNvGnUnQ4A8G3ub8oGSqk-lpGNR4XETP1bYpGVXmGBzbaHuYC0f1BfAr-t5oWkcbDwQJJDWe4NUpmqGSj7ro4gaEICEJSbjXPKaOBAf9&xkcb=SoCW67M39QgCmly2A50IbzkdCdPP&fccid=d921f5450b899369&vjs=3"
50,"Order To Cash Data Scientist","Hertz","Oklahoma City, OK",,"Act as a subject matter expert on data analytics within the receivable’s domain.
The ideal candidate will leverage advanced data analytics, and statistical…",,"https://www.indeed.com/rc/clk?jk=6320ea3932a00aa7&bb=1njvimLpOGD6kBusRFqbmtRjbCg8lmP5N1AbntXhSmpgJKm8Ov3A7MMwognvEqIi25igvTrWCWle3vDECTsjj6jBrlfdjpAIhxDUuaIKPo73mibpVqtlWw%3D%3D&xkcb=SoAY67M39QgCmly2A50PbzkdCdPP&fccid=2198321f20b9c5d3&vjs=3"
51,"Biological Data Scientist","University of Nebraska Medical Center","Omaha, NE","$69,800 - $104,700 a year","As a computational biologist at the Pancreatic Cancer Center for Excellence (PCCE), in close collaboration with bioinformaticians, biological scientists, and…",,"https://www.indeed.com/rc/clk?jk=b1b85fc2beb86020&bb=1njvimLpOGD6kBusRFqbmhsR8rR5u7vEsf67aAN3oCsytL2jmOvSzKSJSLtw5eVHh02NjvsICCmqBA12122WX2bg2ksW6aL59n8tT-Jq5m01nTbvpnmQew%3D%3D&xkcb=SoCs67M39QgCmly2A50ObzkdCdPP&fccid=b8b24773975b4576&vjs=3"
52,"Data Scientist","Grit Government Solutions","Fort Eustis, VA","$140,000 - $150,000 a year","Provide oversight and guidance on application of content management systems, workflows, data mining, cloud computing, predictive analytics, statistics, data…",,"https://www.indeed.com/rc/clk?jk=4054aab1ff0e53b0&bb=1njvimLpOGD6kBusRFqbmn4bkXhrHvBJLsg7HYsNhp1m52WhPWpgdi01bsWeY88ypbSi2TftfEIymiYqBuwOSSmGqXb3oLxcsbsTA9G-J3c9qjuIt8t5-bYo6EF98z_Q&xkcb=SoAx67M39QgCmly2A50NbzkdCdPP&fccid=972df28365a3418e&cmp=Grit-Government-Solutions&ti=Data+Scientist&vjs=3"
53,"Executive, Data Scientist","USAA","Remote in San Antonio, TX 78288","$216,750 - $390,150 a year","Leads a team of Data Scientist professionals responsible for advanced analytical solutions that include predictive analytics, machine learning, simulation, and…",,"https://www.indeed.com/rc/clk?jk=52da139480a1f0c6&bb=1njvimLpOGD6kBusRFqbmmDwphwwQJ8WMYdRRgUBWwAxsH9kKsVZNqPra3rTy76gOKCgygSkj0QkkJ6lnJkieS-65yYrw4EOp19FxxXd9bA4yi1cjX60Ow%3D%3D&xkcb=SoCF67M39QgCmly2A50MbzkdCdPP&fccid=3a1edc2d763c4288&vjs=3"
54,"Specialist - Data Scientist","Ally Financial","Hybrid work in Detroit, MI 48226",,"Experience with data visualization, testing, quality, and preparation of analytics end products.
In this role, you will collaborate with model developers, data…",,"https://www.indeed.com/rc/clk?jk=ceaea9459ced5b34&bb=1njvimLpOGD6kBusRFqbmk4DqgpfrqyZs92uC5XRoZNwso5xlD1M2DBZgDArfaddaMM9XNPkDfz0p4VsY6wK-DwPJkjO1xmg-rYX9ilA-VS5s4ge8tVtyQ%3D%3D&xkcb=SoBs67M39QgCmly2A50DbzkdCdPP&fccid=f8c85b296194776f&vjs=3"
55,"Data Scientist I","GEICO","Chevy Chase, MD",,"We are seeking a driven and analytically minded Data Scientist with a strong data science foundation and expertise in machine learning and artificial…",,"https://www.indeed.com/rc/clk?jk=a53b8321fce40531&bb=1njvimLpOGD6kBusRFqbmsoVGNvGnUnQvadQKNwNMZzRYUB260-ohGVfXyaTYT_w_8fXdKis0uky1ep741J4PK5wrfRyLTXEJ-cs8-Odo7xu9mUVDpGyjw%3D%3D&xkcb=SoDY67M39QgCmly2A50CbzkdCdPP&fccid=71b1543b29473502&vjs=3"
56,"Data Scientist II (Northridge, CA or MN)","Medtronic","Northridge, CA","$110,400 - $165,600 a year","Experience in a regulated environment, ideally within medical devices; medical data analytics (examples include data discovery, pattern recognition, machine…",,"https://www.indeed.com/rc/clk?jk=2b8a2d66a4a2878c&bb=1njvimLpOGD6kBusRFqbmvrVCXjA91h7by2h5Ctk-7Jz10QluqR5JBE-kiVgdM_EukBfNiNhEQ6Ndz9GeT4ds5wn9XYPqOpBk685KpjaFA-uJ-kacIZiNg%3D%3D&xkcb=SoBF67M39QgCmly2A50BbzkdCdPP&fccid=f06a4d05bf5510ec&vjs=3"
57,"Data Scientist","Greystones Consulting Group LLC","Washington, DC 20003 
(Capitol Hill area)","$70,000 - $110,000 a year","Develops strategic data modeling processes, accurately identifies cause-and-effect relationships, and leverages expertise in integrated development environments…",,"https://www.indeed.com/rc/clk?jk=d64f11187fe47c1d&bb=1njvimLpOGD6kBusRFqbmoyg2MgGnrvO97mzPlzSkxs_xcibQVPbt5N6AHkbJiw3covy6dGlv7vwmsGhX67OvVc4r3fAx-9BF1oQp6sUj7JPE8fUyj9Y1c-QRHEzXdta&xkcb=SoDx67M39QgCmly2A50AbzkdCdPP&fccid=c217704cc373c1dc&vjs=3"
58,"Senior Data Scientist","Protellhirestaffingsolution.com","Cupertino, CA","$140,000 - $160,000 a year","8+ years of relevant industry work experience in data-driven projects with a well-rounded understanding of statistical fundamentals learning.",,"https://www.indeed.com/rc/clk?jk=3c3ab259a7c51630&bb=1njvimLpOGD6kBusRFqbmgYVxCR3H7dEpo-Q40s9RlWu3-hYxtPY571HIC3AONUHZSkgzdEU_rTDlPUlVd3tAfuyScBI0dkXxIpuClZOk5j0tC0Ug87Pw3VK9aj9AjZ6&xkcb=SoB_67M39QgCmly2A50HbzkdCdPP&fccid=f0564b375a9b4b25&cmp=Protellhirestaffingsolution.com&ti=Senior+Data+Scientist&vjs=3"
59,"Senior Data Scientist, Generative AI","Scale AI","San Francisco, CA","$172,000 - $206,000 a year","As a member of the data science team, you will lead the charge of building our data science infrastructure for Gen AI products and driving insights that lead to…",,"https://www.indeed.com/rc/clk?jk=5eb7ef8ca9b9e053&bb=1njvimLpOGD6kBusRFqbmsPUs9Q4IJI2LeR__LsvHachEBzbqBIoCFK7ktZIK12rSRfKtFxtDdKz6CTqOViph1ED3sopQqLjWecmWGNoWzTa2_MvLV5xkUlLcSbVJEwE&xkcb=SoDL67M39QgCmly2A50GbzkdCdPP&fccid=4eacfef094c1e91a&vjs=3"
60,"Data Scientist VA-1509","Quevera LLC","McLean, VA 22101",,"(U) Demonstrated experience in Python development with expertise in Python data analytics packages such as pandas, numpy, scipy, gensim, and scikit-learn.",,"https://www.indeed.com/rc/clk?jk=ce70c4e6ffcbdf3d&bb=1njvimLpOGD6kBusRFqbmstbQg2eVXEonYGtdKDYNeUa5kSSJ9erzWOJWM_1e5c0RZmPmjcqqUrbMqP-JbB0qtnF_HQfDdLya0VXadwLRNY78nizVDoxTAyCxnUraYCZ&xkcb=SoBW67M39QgCmly2A50FbzkdCdPP&fccid=be24e5d327a08716&vjs=3"
61,"Data Scientist VA-1509","Quevera LLC","McLean, VA 22101",,"(U) Demonstrated experience in Python development with expertise in Python data analytics packages such as pandas, numpy, scipy, gensim, and scikit-learn.",,"https://www.indeed.com/rc/clk?jk=ce70c4e6ffcbdf3d&bb=CW9aUwiCnZ7udZzSRhxt6QqznlaZk2XergdJVqenan4lWb8XSI_cFDpo1ToDbKoKGo7OhtneLCM97lwZSR6H1ySAkfXwhC2e4pJZuN1Lmr1r9WDo_W2j22_5G0dcBgfw&xkcb=SoBB67M39QgCQ_w25h0LbzkdCdPP&fccid=be24e5d327a08716&vjs=3"
62,"Data Scientist","Transaction Network Services","Virginia","$135,000 - $165,000 a year","This role involves analyzing complex datasets, developing statistical and deep learning models, and implementing advanced machine learning solutions.",,"https://www.indeed.com/rc/clk?jk=1d953fec7bc52fe7&bb=CW9aUwiCnZ7udZzSRhxt6UWSB3AoqGpMA3vGjYP3UTzBEACXxD3NUF4l5VU1Uzeu4zbmHA0wBn5R6DZQTs_7ijHzADp7W_sOps1VmBpihm9YBnk9mw5CtRyKKkdq9cwU&xkcb=SoD167M39QgCQ_w25h0KbzkdCdPP&fccid=dcce7a0c9a34f673&vjs=3"
63,"Data Analyst/Scientist","Risk Solutions","Hybrid work in Minneapolis, MN",,"Have 1-3 years experience in data manipulation, cleansing and modeling or equivalent demonstration of core skill set required to satisfy project requests.",,"https://www.indeed.com/rc/clk?jk=67f1c8b4e09367a7&bb=CW9aUwiCnZ7udZzSRhxt6WequwvnR5JZbqDszgFbRSDkXa9GS-QP_CKoCdisKqvKoROVZA8beFae6oWB0MvlYUnvu-rmVDYeE-Z_nEiwZGG_a87uJB1zOgx01dgkIYvz&xkcb=SoBo67M39QgCQ_w25h0JbzkdCdPP&fccid=4d07247f1ac72363&vjs=3"
64,"Sr Data Scientist","PayPal","Hybrid work in New York, NY","$84,500 - $204,600 a year","Job Description Summary: We are looking for a Senior Product Data Scientist for the P2P Analytics team who is very strong at generating valuable insights from…",,"https://www.indeed.com/rc/clk?jk=fa6bec3c05e05005&bb=CW9aUwiCnZ7udZzSRhxt6RYfGr25HxQfg3ebd39uqS5JroZoXurE-OZnoAN68ZXb_lMRdDvUiQMTJYNOJPX-JfKw9ZUf7rtPwChHJgaUmDW52KQiT0Upsg%3D%3D&xkcb=SoDc67M39QgCQ_w25h0IbzkdCdPP&fccid=978d9fd9799d55a8&vjs=3"
65,"FinTech Data Scientist","Vanguard","Malvern, PA",,"Identifies potential experiments with financial technology related to alternative data sources, predictive analytics, and machine learning.
Let’s make it count.",,"https://www.indeed.com/rc/clk?jk=ec2f78b069db6fd9&bb=CW9aUwiCnZ7udZzSRhxt6deUAjnE7A56311G2QIVwef544RBTokLg8gRXNwAg5FGrIx82doS6yaiSyr3bOB204NLZauFdIeoYwk2jIYTP9_OaW3hsigTvg%3D%3D&xkcb=SoBS67M39QgCQ_w25h0PbzkdCdPP&fccid=510aa29fcf8f87d9&vjs=3"
66,"Data Scientist","Plexus","Neenah, WI",,"Communicate findings and insights through effective data visualization and.
Analyze complex datasets to identify trends, patterns, and insights that support.",,"https://www.indeed.com/rc/clk?jk=cdfcf098d2fc5cb3&bb=CW9aUwiCnZ7udZzSRhxt6Z9ZVjv6ihb8I5c48zHYnTLvalDCurNLRCjTP1u0iE7LZo-e4ILhZM9qB_9K-Rv2lS5SmfWU8Xc8gx-Rfxp7OcLlrgP92O7dJRZf9kjc2xWe&xkcb=SoDm67M39QgCQ_w25h0ObzkdCdPP&fccid=f46d2a22e8c08ae8&vjs=3"
67,"Senior Data Scientist","Autodesk","Remote in California","$136,000 - $220,000 a year","Demonstrated expertise in data modeling, processing, and analytics.
Minimum of 4 years of Python development and familiar with machine learning packages and…",,"https://www.indeed.com/rc/clk?jk=8165db2537d167fe&bb=CW9aUwiCnZ7udZzSRhxt6TLAn-2A7rmUVg7M2p6hipCnKEPSJ01yBZD7Q-JjQCn7Hrx77rzLqK2HYZMMnG1TxtLa6H1AUcMxkeP7N2bi6IwZnHM-4XGQwm8vjec8oQ41&xkcb=SoB767M39QgCQ_w25h0NbzkdCdPP&fccid=7136762d065a5ad7&vjs=3"
68,"Statistical Assistant","Infojini Inc","Menands, NY 12204 
(North Albany-Shaker Park area)","$37 - $40 an hour","Monitoring macroeconomic indicators such as long-term unemployment and the Consumer Price Index for informing the interpretation of program participant caseload…","Employer
Active 3 days ago","https://www.indeed.com/pagead/clk?mo=r&ad=-6NYlbfkN0Anf6jJp3o99dkiXR3U9YqnwbHyRLE-Aep-9JQoPN7RZaijeiJpuCay3BpeAm-pvtG42QfNLf26BsEjDbn5yKNSlHyxK3xPXmOc5kn0-Jmr1hBKlLyk4g9ly26i5BISf3A7sMH3w7FuIQ-GMCHZEMQZMGEpfNhIpPexaYvQuw4DmiuPFEukXWIKe6E3wLEWZqpX8SpS6vuOP6uxf6LSMAoq7nAPBf716dk520qibLYJ2_2THBozMKaLOW47urdW-sRhKoPWfR96NffXUIex0Ho4sV_WHFZ8hVQa_AkaX7NtUiaDgeDXlcYmmjGp4oTSO44CqENBOtDQ4zyKxJZeQckjja7ByGe8qWDZ0nCbiWdtWxpyJoY0uO72dC3ALwESnVcJnQO2t5GluGBw8VaTImsMJfXsE4CJsfgRdlFfqCSXchutZVhWw2d4UM90Bf-rXsHD1rRA1CqCrT7YtLdkYzBut2LjMt1XxhBGesPASR3vTwyR7ceotW-BQUoBi33sJgQDffuFT7SYD3E92cn47FckryzUsEojPY6Pr2PcbpkrvpVXhoE_d_Gv7Vnfgp7lD9SW3ajcFBgr4izOkilgTFnWzeJJBAZ8JxIg-4mrtwtU_oY_psMA32wZoXWvP737F0o6LocKYwT6tSpFsAhbqYzqpIc9txNdtpS8ZOZIcrjj3CTmcLXw47hV&xkcb=SoA76_M39QgCQ_w25h0MbzkdCdPP&camk=4HOcmqOLYrAA3dX6ba566Q==&p=7&fvj=1&vjs=3"
69,"Data Scientist 2","The Church of Jesus Christ of Latter-day Saints","Salt Lake City, UT 84103 
(Capitol Hill area)",,"The Data Scientist will work with both structured and unstructured data from multiple sources and will provide strategic data models using machine learning…",,"https://www.indeed.com/rc/clk?jk=6666a40c58be9318&bb=CW9aUwiCnZ7udZzSRhxt6ZBlccgQXibPnoAX3ymONmi4ZgQ07FBBL5-AJE74YlLAsA1NmJqkbbxXDCVe4zZwi-UYq91YWmd0ZrtdyOaGzcmTNn5KXBLclqQBvq0al0mL&xkcb=SoAm67M39QgCQ_w25h0DbzkdCdPP&fccid=7e408d96768a4a43&vjs=3"
70,"Data Scientist/ Machine Learning Engineer || Full Time","Braintree Technology Solutions Inc.","Fort Worth, TX",,"Solid understanding of machine learning concepts and algorithms, including supervised and unsupervised learning, deep learning, reinforcement learning, and…",,"https://www.indeed.com/rc/clk?jk=113a1036e8caa367&bb=CW9aUwiCnZ7udZzSRhxt6WBMEOJzRpmfiDL3nGyE-AUh8Z9Qvgp3bu9KMBY8yvQn1jwrZwrkVa7OpoyHmGMRiijSB2Ei5d9YYTlawt3wUuACLHZo0rAp1E2xSF0EsKFX&xkcb=SoCS67M39QgCQ_w25h0CbzkdCdPP&fccid=404003403215aa69&cmp=Braintree-Technology-Solutions-Inc.&ti=Machine+Learning+Engineer&vjs=3"
71,"Data Scientist","City of Seattle","Seattle, WA 98104 
(Downtown area)",,"The role will be responsible for building usable data tools for staff, as well as being the subject matter expert in analyzing and evaluating data sources.",,"https://www.indeed.com/rc/clk?jk=4f0e4b1981fb93e7&bb=CW9aUwiCnZ7udZzSRhxt6VAORFsSe7zx7XzwDnPRGgyMrHXcW_58WqC-GCiBTFJ6lFm-ehzWdlLtZrY_-OmOG9FMcYq5CUAQgVCTCW_1odaV8uab6_4yw4rR9tdNUJ6X&xkcb=SoAP67M39QgCQ_w25h0BbzkdCdPP&fccid=7ab02d0382dcd5b4&vjs=3"
72,"Data Scientist","Barbaricum","Remote",,"Interpret and analyze data using exploratory mathematic and statistical techniques based on the scientific method.
Proficiency in SQL and noSQL databases.",,"https://www.indeed.com/rc/clk?jk=4f85bfb3e0e4b091&bb=CW9aUwiCnZ7udZzSRhxt6YdQEIH3w6CUybNvqwpv11GNzq6JBHAp2Fc6U-p_dO8uTHiOIRgKd1RhikVh-131tXhvXzjp_w-Es9GL_oSNgGIxupo8XSFCeZGhJkBleued&xkcb=SoC767M39QgCQ_w25h0AbzkdCdPP&fccid=0ce8583f8756e02c&vjs=3"
73,"Senior Staff Data Scientist (Xpanse)","Palo Alto Networks","San Francisco, CA",,"Explore and characterize our internal data for cybersecurity insights relevant to our current or potential customers.","Employer
Active 4 days ago","https://www.indeed.com/rc/clk?jk=51d027a1876db6f1&bb=CW9aUwiCnZ7udZzSRhxt6Y20ywlsFxODWFd0xhU_qc5LRTP9AglVpgWvECfPggSIoErPFjfb0bY8Ay7naUM3PpXP_NLV8Y3giDyDfM-hiuJrynZv-DFWphdOumiO4RiY&xkcb=SoA167M39QgCQ_w25h0HbzkdCdPP&fccid=0562f887e2bed9ea&vjs=3"
74,"Senior Data Scientist - EHS","AbbVie","North Chicago, IL 60064",,"Develop and execute on analytically-driven data monitoring programs, designed to identify emerging compliance an injury/illness network risks incorporating…","Employer
Active 3 days ago","https://www.indeed.com/rc/clk?jk=42d0f12dda91aba3&bb=CW9aUwiCnZ7udZzSRhxt6QqznlaZk2XejittDysx5oPZ0_3IxNi6T14CwuCVKeWQvH-_AzIuzL9xDzmfOSm4u0HLOcrmA8RXJr-yMABgOKs3HbvgXmvmQfHpH2bNLWTZ&xkcb=SoCB67M39QgCQ_w25h0GbzkdCdPP&fccid=a3b51ece17c02aae&vjs=3"
75,"Data Scientist - Fraud & Payments","FanDuel","Hybrid work in New York, NY","$150,000 - $190,000 a year","You will help manage the roadmap and evolve how FanDuel looks at the fraud and payments space using the advanced statistical and machine learning methodologies.",,"https://www.indeed.com/rc/clk?jk=ecbd4b84733c81a3&bb=CW9aUwiCnZ7udZzSRhxt6dqWhC37DFH8Uc_hmu4X2BD5R7cYv0StZzoiXAta-IdsD140NlKx9VTvQSWRFgP9oXlvgS-77blc8Q5n2Ly8aDINLCZxeJGkTefbQR58B2Hz&xkcb=SoAc67M39QgCQ_w25h0FbzkdCdPP&fccid=ada833cd00ae27d8&vjs=3"
76,"Data Scientist II","Cox Communications","Atlanta, GA 30328",,"The Data Scientist is required to have strong skills in advanced analytics algorithms, tools, and technologies to drive solution development at scale.",,"https://www.indeed.com/rc/clk?jk=a3c9aee78e5f126d&bb=kcAvg9n_ZQ7pWAtFFr7EecSwaGAvOwIK4cPtMr_8RuIP6O6aDBz99K_BHHCXioMTI4U_ULCllI2Woh8W2uaoT4uBX2X0AQjz_Nx1zx34jrGsC_2Gvsn4QJSqzfRU6JOL&xkcb=SoCX67M39QgCKuQ3xJ0LbzkdCdPP&fccid=c7e6b037b4d816c9&vjs=3"
77,"Data Scientist","WEX Inc.","Portland, ME 04101 
(Downtown area)",,"Familiarity with various machine learning algorithms and experience with deep learning libraries (PyTorch or TensorFlow).",,"https://www.indeed.com/rc/clk?jk=c8523cc51193abba&bb=kcAvg9n_ZQ7pWAtFFr7EeRJeLiLnY1n105frYS3Op7LQCfcfAKzyHbNNBctTkcSssFg7Uv-7NuH-pYAM93kOygFuboJlUh6-uYSQ6tqbteOr0ZiJLAcrtw%3D%3D&xkcb=SoAj67M39QgCKuQ3xJ0KbzkdCdPP&fccid=c9538b927313f8e0&vjs=3"
78,"Data Scientist","C-Star Solutions, LLC","Springfield, VA 22150",,"Experience in cloud environments with a blend of data science skills (remote sensing, physics, geospatial, imagery process, etc) and computer science…",,"https://www.indeed.com/rc/clk?jk=4306cba47f4cb74f&bb=kcAvg9n_ZQ7pWAtFFr7EeRJeLiLnY1n1Sf8I5wlY1mpNhHN93psJjBXTnluZGNE69M-rrIoRGDEmYXUgu8OqdevYMUYFDt2t0ao1KptmVqUOLrcmflqlyqxJ8tE-_7WM&xkcb=SoC-67M39QgCKuQ3xJ0JbzkdCdPP&fccid=dd616958bd9ddc12&vjs=3"
79,"MIDDLE DATA SCIENTIST","LeverX Group","Georgia",,"Great understanding and proven experience with machine learning (both supervised and unsupervised) classical models and time series methodologies and experience…",,"https://www.indeed.com/rc/clk?jk=613a0301f1ed636f&bb=kcAvg9n_ZQ7pWAtFFr7EeTKjdSNB9timb7Cydz3Wt7PY3Mj9neQcLkJoSGhgoH87p9OZlPZyQmmQgfLWDrerKJkJVEESfVMk1cJViBG8uyYit2SsEyY8N4QNTMqhqv5X&xkcb=SoAK67M39QgCKuQ3xJ0IbzkdCdPP&fccid=59a8e318cb4dfe13&vjs=3"
80,"Associate Data Scientist","The Hartford","Hartford, CT",,"You will be part of a multi-disciplinary analytics team, collaborating closely with data engineering, performance analytics, business intelligence, and data…",,"https://www.indeed.com/rc/clk?jk=fd3421296ccca70f&bb=kcAvg9n_ZQ7pWAtFFr7EeRhlozVQM-LfZYBZTszqA6_gP9gtPPmh29UXGE65KtU3eoaef3tEc3LS4X_fp1XZBq3gSxxE6TdpMqb1AnBCN1XKQ8uP9qn1Hw%3D%3D&xkcb=SoCE67M39QgCKuQ3xJ0PbzkdCdPP&fccid=25d3835187829237&vjs=3"
81,"Senior Data Scientist","INISGHT2PROFIT","Beachwood, OH 44122",,"7+ years experience in a data science role applying approaches such as statistical models, gradient boosted trees, deep learning to business problems.",,"https://www.indeed.com/rc/clk?jk=42663e3f1bf8b1ed&bb=kcAvg9n_ZQ7pWAtFFr7EeVteSxBJi5eOaye4hG3WJ1B4L3U1O89R0FCF9UyNi2GjMzaqyprOsdFncnOIQ8WdHTuLbnu4y-FC3VDJN93-cDcIsYdyCC9RX3FuMtdze-ee&xkcb=SoAw67M39QgCKuQ3xJ0ObzkdCdPP&fccid=8b8065a340e78bbd&vjs=3"
82,"VDH Data Scientist (Locals only)","Raag Solutions","Richmond, VA",,"Familiarity with health/public health data.
The Data Scientist will collaborate with stakeholders, subject matter experts, and data stewards to ensure data…",,"https://www.indeed.com/rc/clk?jk=8f52af63485e3787&bb=kcAvg9n_ZQ7pWAtFFr7EeZQ766e3OSwP07qU5SQfIKn3HbNvJPwBupJcm190Gia_Dow3BCfHg9xBPnJQ_8pArepOpX940rrY0HXB--smd5BnadcNuJ5wjtOzi5vzFBrJ&xkcb=SoCt67M39QgCKuQ3xJ0NbzkdCdPP&fccid=8c9bc4383199682b&vjs=3"
83,"Google Contact Center AI Expert","Cloud destinations","Remote",,"Strong understanding of NLP and machine learning concepts.
This role requires a deep understanding of natural language processing, conversation design, and…",,"https://www.indeed.com/rc/clk?jk=eea5568e3a75dbc7&bb=kcAvg9n_ZQ7pWAtFFr7EeaLRWBT0yJ6Bau6tAxtMACu9MEMxlAS7x8iM3iW3oecO3ditVuQtSY9Pah8ZO3U9RFrPlOPItHUHZQ31bvkOBZe3sgvCQ6TabTG3thVav6rh&xkcb=SoAZ67M39QgCKuQ3xJ0MbzkdCdPP&fccid=b99fcc83a29d38c4&cmp=Cloud-Destinations&ti=Contact+Center+Engineer&vjs=3"
84,"Senior Data Scientist","Microsoft","Redmond, WA 98052 
(Overlake area)","$117,200 - $229,200 a year","You will work on all aspects of fraud detection - anomaly detection to find traces of new attacks, correlation of multiple data sources to define the perimeter…",,"https://www.indeed.com/rc/clk?jk=d597a15be258fa99&bb=kcAvg9n_ZQ7pWAtFFr7EeT4LSfYtF7jV8990ujtNm-8lbdqJy_uNyRuOiafSDo0jM5HgZ6s5M0jYN4ABUsQ8T3S5_0j1GEpLHGsqPRByvN4SNqTo_v2EOw%3D%3D&xkcb=SoDw67M39QgCKuQ3xJ0DbzkdCdPP&fccid=734cb5a01ee60f80&vjs=3"
85,"Senior Data Scientist - ML","Twitch Interactive, Inc.","Remote in San Francisco, CA",,"Experience leading development and deployment of machine learning- and data-based forecasting solutions in production.",,"https://www.indeed.com/rc/clk?jk=a0b27e669255fea7&bb=kcAvg9n_ZQ7pWAtFFr7EeUz1f7mfdG1ZxnnKpEEdgUJwRdUztXZLU8m6w1zVKGDhbuQBK139Hp6_iLoJVeZ1w-llKbR8YUMdpd67tVnkVJR974jag1pt1g%3D%3D&xkcb=SoBE67M39QgCKuQ3xJ0CbzkdCdPP&fccid=fe2d21eef233e94a&vjs=3"
86,"Manufacturing Data Scientist","TAMKO Building Products LLC","Dallas, TX 75216 
(South Dallas area)","$120,000 - $150,000 a year","Develop and deploy machine learning, predictive analytics, prescriptive analytics, and advanced analytics through the use of Digital Twins.",,"https://www.indeed.com/rc/clk?jk=b80260b361082b0f&bb=kcAvg9n_ZQ7pWAtFFr7EeVbJ6C-QgYH3OkfJGW--70YGCYC9WPv2b59Cpbiv59Mszff1ycT0muOlXeFpKgXgz4jQovgAWhOAqTmx1_6CgSDpfKE2eSjo-QDt_koCaMY9&xkcb=SoDZ67M39QgCKuQ3xJ0BbzkdCdPP&fccid=73185f6ad5b10e1b&vjs=3"
87,"Data Scientist - Demand Forecasting","Tiger Analytics","Remote in New Jersey",,"Strong proficiency in programming languages such as Python, Pyspark and SQL, and experience working with data analysis and machine learning libraries.",,"https://www.indeed.com/rc/clk?jk=d13dcddd0942cbfa&bb=kcAvg9n_ZQ7pWAtFFr7EedQm2Pg8Gq53guPE2IUFn7NbtUKsTb7vCs3ocwj3nf9nJzxdRKTdP4DPUQ7YEt4N8-ZIV68fNlIrDrePiDz4HE4W7jCYCF85bwLP4cIfchIw&xkcb=SoBt67M39QgCKuQ3xJ0AbzkdCdPP&fccid=cba01270e96bb012&vjs=3"
88,"Data Scientist","BAE Systems","Norfolk, VA 23523",,"Regular employees scheduled to work 20+ hours per week are offered: health, dental, and vision insurance; health savings accounts; a 401(k) savings plan;…",,"https://www.indeed.com/rc/clk?jk=1753dfb703f11b4f&bb=kcAvg9n_ZQ7pWAtFFr7EeVteSxBJi5eO0AXkUmO2d7875gTpcnHOfBRolLj9D1KWGCk941SiHw8CPB0INEYAhgTHw0Nk3RwmZmdeso-TDHyGPLuzZM5nSpK1h8Xgyo8n&xkcb=SoDj67M39QgCKuQ3xJ0HbzkdCdPP&fccid=200a825acadb9338&vjs=3"
89,"Senior Associate Data Scientist","Infosys","Raleigh, NC",,"You are expected to have prior experience in end-to-end implementation of RPA bots that includes identification of ‘right’ automation opportunities, designing …",,"https://www.indeed.com/rc/clk?jk=b22c7e0dd1c6dc5e&bb=kcAvg9n_ZQ7pWAtFFr7EeZR0h7v4wUQ00iudo7V54bj0gG2o-m09TuBgTXz0Nn4Jqb2wAod_dFFPY_45ISEAg07tIMofnVQGZjcth3KpZvlHLmpEpcndCbg0QIl_UOCM&xkcb=SoBX67M39QgCKuQ3xJ0GbzkdCdPP&fccid=c67533a523c83a4c&vjs=3"
90,"Data Scientist AVP","Morgan Stanley","New York, NY 10036 
(Midtown area)",,"Demonstrated breadth and depth in knowledge and applications of machine learning algorithms in classification, regressing, recommender systems, clustering, deep…",,"https://www.indeed.com/rc/clk?jk=aa2212da756bf578&bb=kcAvg9n_ZQ7pWAtFFr7EedDmLVVEQ5OP9DgeaJJoJeJpQLbj9oHnbfZfaKjRKgWCGt1Q50M5dAsTHIHlL6qdZTDfoA8sF1ROUkZ2PTIdDM1hkIQembCvUw%3D%3D&xkcb=SoDK67M39QgCKuQ3xJ0FbzkdCdPP&fccid=0c39fb2c91742dcf&vjs=3"
91,"Senior Associate Data Scientist","Infosys","Raleigh, NC",,"You are expected to have prior experience in end-to-end implementation of RPA bots that includes identification of ‘right’ automation opportunities, designing …",,"https://www.indeed.com/rc/clk?jk=b22c7e0dd1c6dc5e&bb=8571CQqf6CDWYgeoBGSNS7SKcpz1cnIhnE3pPRKw_T-QES1iAf1ECqZXVg52ygQZjlfOulSd5zpA2Pqce0JT4wisrYyKvEp4uLSgWRtMIpBK9bfXfK9pjNw1ryZIlWWv&xkcb=SoDx67M39QgBijAcpj0LbzkdCdPP&fccid=c67533a523c83a4c&vjs=3"
92,"Data Scientist AVP","Morgan Stanley","New York, NY 10036 
(Midtown area)",,"Demonstrated breadth and depth in knowledge and applications of machine learning algorithms in classification, regressing, recommender systems, clustering, deep…",,"https://www.indeed.com/rc/clk?jk=aa2212da756bf578&bb=8571CQqf6CDWYgeoBGSNS-oUEy2zVM5Cw_drkDDDLl91lXDvC1EOdNGxoU6Ujw7MZzJFzmGufKPFOfAeDlJhjBLerLWxm7csVMMHUDRb7rQtTA0kRBtPjQ%3D%3D&xkcb=SoBF67M39QgBijAcpj0KbzkdCdPP&fccid=0c39fb2c91742dcf&vjs=3"
93,"Data Scientist III","Tufts University","Hybrid work in Medford, MA 02155",,"A background in bioinformatics, computational biology, biostatistics, or related field with experience analyzing large genomic and transcriptomic (bulk and…",,"https://www.indeed.com/rc/clk?jk=bd262c4006f949e1&bb=8571CQqf6CDWYgeoBGSNSy8V8qA5ddDKP0DaUx1JZYPSQZNQhHvlD5cOzJJwzTJ6rDzPIpIPPZfUEDp7WXl6HxEaJ86e5vyZ6pEMqNrZS_M-OH1gC_77Nw%3D%3D&xkcb=SoDY67M39QgBijAcpj0JbzkdCdPP&fccid=6204ad93e6d7930f&vjs=3"
94,"CS - Data Scientist / Machine Learning Engineer Student","INTEL","Phoenix, AZ",,"Statistical analysis, machine learning, and deep learning methodologies understanding.
It consists of competitive pay, stock, bonuses, as well as, benefit…",,"https://www.indeed.com/rc/clk?jk=21f1e7cad347a225&bb=8571CQqf6CDWYgeoBGSNS_XyDhN0z3M1iwGQzADLxskNgXCrJdSWALNaKmIE8V1aVanPzmD3JcriiCDi_BrCwMdusVlVSBDzeXYL2xWJFxBgOLXCV3Ttew%3D%3D&xkcb=SoBs67M39QgBijAcpj0IbzkdCdPP&fccid=936367796261bd6e&vjs=3"
95,"Senior, Data Scientist","Intellisource Colorado LLC","Seattle, WA 98119 
(Uptown area)","$108,000 - $216,000 a year","Use machine learning, deep learning and data mining techniques to develop robust predictive models for anomaly detection such as E-Commerce return abuse,…",,"https://www.indeed.com/rc/clk?jk=9cb985cc672671cb&bb=8571CQqf6CDWYgeoBGSNS1a25m8ENvdIFVzfv3bnZNLmPCnva01MugLkODd7TrLMDRKrz0DCgeADw6HZtJiQvJ5P-aqpBDmCA7pqi-PFj-cHwqbP6WTzFwhgdtIPQGn-&xkcb=SoDi67M39QgBijAcpj0PbzkdCdPP&fccid=bb9c2686d851ace0&vjs=3"
96,"Data Scientist","IPG Health","New York, NY",,"Provide business insights through comprehensive analysis, integrate diverse data sources, apply advanced quantitative methods for customer segmentation,…",,"https://www.indeed.com/rc/clk?jk=f2bfe529319ee482&bb=8571CQqf6CDWYgeoBGSNS7e7qVSYoAcRXsm1j0d7IURXi4sC0FGZoIR9V_s95HWcaHzgLk2_zVdRRbp3QfcMaG_2e5moZ2V1bYvHQU-4TYSfu-SdGyRGvsk9ud4CIfLm&xkcb=SoBW67M39QgBijAcpj0ObzkdCdPP&fccid=374f886155c4b81b&vjs=3"
