"Position","Job Title","Company","Location","Salary","Short Description","Posted At","Job link"
1,"Data Scientist","Robert Half","Remote in Los Angeles, CA 90024","$120,000 - $140,000 a year","The ideal candidate should be highly skilled in all aspects of data analytics, including mining, generation, and visualization.",,"https://www.indeed.com/pagead/clk?mo=r&ad=-6NYlbfkN0CpzDdaQkua3np5pkmj49lKioZwmwxQ-yx5plwbYmV_M5ua1VBbglK-9_7yLoyXUJJSmXPxlCqD6E6A1vF0-U4SLLxmdIT_rM_QyyVT4Dr2cMj3scCRceMimf5HDr1-yCJRUY7nfirJcxVoiW1anhsgu7hkTD_SsGOZUD4U13-GI2_Rvz7KtwkFQY29DUZD32DctTEWCyssI4thfZF6_wknUxvbEfLsPZtut3KdkteOXcFAAA4byCiViRFcGwvrJD435RFPbLF-WMfGXaDKwWhGaFo-NFCNbmesizlPR52Sgogxu9RxbIWF2e-0YupLj5crZtM7U555ZefIPfRQB6Zjwcrn6YenvAbMP-xjgvHfqOUztlHYuWqUhHcpzW3BheR-mHKxE_kVX42cVvNr2KnJQZ9RvUw-M-3fyCOl2IHa0ReOjA3Fzdy7NM83jJdksRf7JWORDgG8WSq_GPQuCZT6-xtBMKi5EzofsF2TPsIew2fpfc7omLYORlCiYMho151Hhc1O2tSQK58fEdDgW3vFWkZ17MlD0_WzAAffDmnH9WRr_Z06LmFZOTOpH4eVq0L75vERBzSLgSORhangQ0HFxxsRRfSCUfADcELvTHdaqe7KdZy_IBqNF8VAhfc7gOaxDPVghKSLNEpvCrHz9_gQ9xdcKgQqRPuIgNyj-WneH7iMvVqc85-hDFn8WFM9t9vXpG0J7Wgdrd9CwGdces117GtJGYCmVWxi0k2dvdl2MA==&xkcb=SoBI6_M39QgEpPw2050LbzkdCdPP&camk=nUmJqO2E8riCTYWaePDGtA==&p=0&fvj=0&vjs=3"
2,"Senior Artificial Intelligence Researcher for Scientific Discovery","Johns Hopkins Applied Physics Laboratory (APL)","Laurel, MD 20723",,"As a member of our research team, you will contribute to projects in a variety of ways, such as designing, training, and developing machine learning (ML)…",,"https://www.indeed.com/pagead/clk?mo=r&ad=-6NYlbfkN0DND_cY4AdZ9uf0CyzxvdaEIkE64BMiSLR1NLUGRAKCdb0EIWzKl7iUQ7clxobffV8AMZ62Ymh-_C2HUqiuA1z6myShC5DIJ5VsnHThadPbuh4AG4hVMNOzx_khLkuWAD6QoIAM2AS3LomiGorU6csZPziEDzv4COG_QEgP2we6m9wO9gbuod-KvfegIbwOTrlNg524M8W2SDD-V4f7FkUEVCTTzzz75Y1JgM2Pji9bfA1DA_aBb8rFMP5wVdiTKa8uFXUPBpHbMTmkH9NRuyM9WItDW5pnbX1QexqiAKdi41AXsTsp0TNEfDLFwzRVAiG6MTHEYu6NfDtfPHUxV24t562STgjfQcWWmY3jtH3c03mkpeKMz1sgzLO0-jyw31X8rZM2ZJUlYf95D3Z5XZi1jFnZy-pn9y_xfvVvAlEoLJ6ZPqncX2c08RYaLd56W-9C_FpxaSij94TXuPYSC00ha265TanlIKxKbZxLUAPw6PGdrqQ5C-s_4vv-Deg1KXPym_jVmH8hZ1PHzyXyO7o-KhT4F3WxcyVGPG01CI_z-6BfEat09uouGDwYfp7HUlhdPoSP-EpzVR_xYKXPYQTUoKMWG8VLBY10rc-BbXpEXdY8QX5LXl0c7Q5Ds8muDkjSaxM38zTKPw==&xkcb=SoD86_M39QgEpPw2050KbzkdCdPP&camk=H-lBaXMUocJHgoO6EZRaIg==&p=1&fvj=0&vjs=3"
3,"Senior Data Scientist","Modern Technology Solutions, Inc.","Huntsville, AL 35895",,"Utilize machine learning techniques, algorithms and/or artificial intelligence to improve data analytics.
Acts as a subject matter expert in data when involved…",,"https://www.indeed.com/pagead/clk?mo=r&ad=-6NYlbfkN0C26OT7h5zXl7z1yVTYwN1d43osiYS9hmGqw_eY7i5KF4BfiQkczdjRxOGPN-vMk8vHzYMMvJ-Dlz2C4GI9B-NtRDuDW9fB87kzUB6vjcphEz8R6YzDooRN5Xz74Qd9NeZg4l074TDFi2cqXkjnxtaJe9CgmzLE10vHMVQz6EUNOhX1pBH53ZNvFX5dErC36Z6tui4f4gm8aqZg8pbjUjKvtWXmvZiDL7nn8h85sJvl-D3M2hk6AexWyFm94yY56buLW6IrMIgEXVPOeCh9IZlr7lA45Vvx3YC63oiMWJ6123J92PZX_MKIJTz8DmVM40LraZTsTixIIevat3JRCa4x1PzAQ17y8ya15b6oUTmC_0ILnt8SvHfkRtALI3nQdaB16kantHBRlIjBTQRESWPWsYl454kQodHipHzuDiwvqgXx540JLoPo00AFGMStdDbVRhlKUucIELN5aacKttde8mRI5aGG7D18IXnYDrhJ0u2Zbk7RzmD7ZVn4S4C2u_bt8IGZHvnpG8af3cD_err5VY3qh63KMwBtmNrCPUKSd0_945UH7bg_U-sdVTlQXvqzliCU-ZRHoQnHFBzSpsKftamlACXW0R-P4USzigZi4kKas98CQQ-Wjnibfmdh2fnr1Wr76ndS-7BOnIharz8L_qII8Mg0a2qCMdWYXnIIf8qEmvZjwW6tl9qfVyu1yJeJMdPwX49LctcX-aQD77gORIeI8fjWABsS4F7HEn-fBIcrNsSR2vn2vUMP5WmjuChSIoBE01uCNS4UBEUGrV48mEuRznopPKcr1qOSUyLFeb48nj3QXuILw_1IP6BO6jHhxYQDN4dQDw==&xkcb=SoBh6_M39QgEpPw2050JbzkdCdPP&camk=H-lBaXMUocK-CM8rzi8HLA==&p=2&fvj=0&vjs=3"
4,"Data Scientist","Twitch Interactive, Inc.","Seattle, WA",,"Conduct ad-hoc analyses, build robust automated dashboards and self-service analytics to empower team members to make decisions based on applicable insights.",,"https://www.indeed.com/rc/clk?jk=4593a41913786e5b&bb=XXPpoFVwJuShmV2H6BQMP-bTQ1qd-BI0nElsZwxMuDk25wPMbmKO13ISCAZBIMK16sGR-7kxWbfyedHq-ZT1sAIW5ooBQcQni0uOpWwf6BAZQ2e4amGEHA%3D%3D&xkcb=SoAh67M39QgEpPw2050IbzkdCdPP&fccid=fe2d21eef233e94a&vjs=3"
5,"Data Scientist","US Office of Personnel Management","Remote","$103,409 - $167,336 a year","Develops and maintains analytics product project plans to clearly communicate project goals, costs, and constraints.
Must be a U.S. Citizen or National.",,"https://www.indeed.com/rc/clk?jk=d393197b7bc4231b&bb=XXPpoFVwJuShmV2H6BQMP-uq8Nz4mvMqVPN0rmz0YzIMcCwbbaaN9W13kdQuD2QJpzEk4uaauIVDmEP6Y_1HVwilhqAK2DdCAND2BsJEI1wv7SVrZ5G4Mg%3D%3D&xkcb=SoCv67M39QgEpPw2050PbzkdCdPP&fccid=e1b4a09f7fb328bb&vjs=3"
6,"Data Scientist","MagicSchool AI","Remote in Colorado",,"Enable smarter business processes by utilizing analytics for meaningful insights.
Proficiency with data mining, mathematics, and statistical analysis.",,"https://www.indeed.com/rc/clk?jk=258a205f5e303b88&bb=XXPpoFVwJuShmV2H6BQMPygLxuU5KGZh0FBoJsrSM1_cVddLssJleCEQNj6bnGC5yQ-lZ0ZXTLfOfgxV9iNEBYYVbqYzLYyvRj1-bacmdxJFMwcF4ja6ZPsDvTiGFFb6&xkcb=SoAb67M39QgEpPw2050ObzkdCdPP&fccid=1f69207e04c940cd&vjs=3"
7,"Business Data Scientist/Engineer","Apple","Austin, TX",,"You will work closely with multi-functional teams, including software engineers, product managers, and other data scientists, to extract insights from data to…",,"https://www.indeed.com/rc/clk?jk=563bac05a887887b&bb=XXPpoFVwJuShmV2H6BQMPzIYPw3C7zqWGV31H1oL_9dVvZn04f6Ld1lMRgmrdtrkpyMPKa6s5Dc3lkslj9m41Y7d_qchwvIDFmG3hKIvjW-UC2W51H_m3g%3D%3D&xkcb=SoCG67M39QgEpPw2050NbzkdCdPP&fccid=c1099851e9794854&vjs=3"
8,"Data Scientist I","GM Financial","Hybrid work in Fort Worth, TX",,"The Data Scientist I is the subject matter expert with an in-depth knowledge of quantitative methods and diligent knowledge of data sources and tools.",,"https://www.indeed.com/rc/clk?jk=85b9540e6b08e161&bb=XXPpoFVwJuShmV2H6BQMP2VDuxuxDp2czo--I-09iA5aY0HzA6_5TzrZp0EKvf1BVTHp5vFVGU89tTHdhBY_yDkyRD4PCRWlTn1-rBRcNfyUiP5IHgf-5g1RJXlJiPW7&xkcb=SoAy67M39QgEpPw2050MbzkdCdPP&fccid=b6e80abbe732699d&vjs=3"
9,"Data Scientist","Ropes & Gray LLP","Hybrid work in Boston, MA 02199","$125,000 - $150,000 a year","You will work with lawyers, behavioral scientists, and other data and visualization experts to help clients use their data to its fullest potential and find…",,"https://www.indeed.com/rc/clk?jk=fec3590ced9d694d&bb=XXPpoFVwJuShmV2H6BQMP-Urk2lyQ4SmwRConBH8JCy1eOaPJndO050YxzIMtFjIatevp1Gukcnr9mqLMhqRAjg47Ycz0pFu8dDat2oyzINK4AxtwtbGVbGqQT-bu9bU&xkcb=SoDb67M39QgEpPw2050DbzkdCdPP&fccid=98eb0c45006b3266&vjs=3"
10,"Associate Data Scientist","UPMC","Pittsburgh, PA 15219 
(Bluff area)",,"Design, develop, and implement health care analytics, marketing analytics, and biomedical modeling programs.
Must be able to manage multiple tasks and projects…",,"https://www.indeed.com/rc/clk?jk=f5de21340edf241a&bb=XXPpoFVwJuShmV2H6BQMPz8ycSv7CS95CNYFsh-467xvPzsy2eUSaMl4bI_fBUauZLTBg-qv184NcfYz8hljlF5Sgw8zNqqrHeMH6dgJmtyx5lnk7t4Mow%3D%3D&xkcb=SoBv67M39QgEpPw2050CbzkdCdPP&fccid=b75dda97eecc3e82&vjs=3"
11,"Data Scientist","Long Beach City College","Long Beach, CA 90808 
(Lakewood Village area)","$106,779 - $145,487 a year","Develops an understanding of opportunities, constraints, and problems from stakeholders' and constructs and executes analytics work plans.",,"https://www.indeed.com/rc/clk?jk=d8685d06c869999f&bb=XXPpoFVwJuShmV2H6BQMP_wPwxNggtgrEkMQYtxOYMqMlhSY71KvtWaB7E_SFanTmnPmZtRzYb89WJlO-8UjU-o6LqOVJXANhUpxSxHsPIS8BG3kcMnzJWWEEhVwxNu0&xkcb=SoDy67M39QgEpPw2050BbzkdCdPP&fccid=df74e677a6aface9&vjs=3"
12,"Data Scientist","National Space Defense Center (NSDC)","Colorado Springs, CO 80906 
(Southwest Colorado Springs area)","$89,128 - $137,784 a year","Knowledge of data science techniques and technologies for statistical analysis, visualization, and machine learning.
Develop data policy and governance.",,"https://www.indeed.com/rc/clk?jk=c93a5b5e6a21fa97&bb=XXPpoFVwJuShmV2H6BQMPz5ScxDu-faGg8nNJ-vB9eDHj98gf9L9jPSBLMzD8IJmeHKVtdbsFZdUIPEVjYjrhA6QGSCv5oOutB3k8CZlz3X9YX9HpgY3Us8RJWiizABD&xkcb=SoBG67M39QgEpPw2050AbzkdCdPP&fccid=1529cdb154c83f90&cmp=United-States-Space-Command&ti=Data+Scientist&vjs=3"
13,"Systems Engineer","Patelco Credit Union","Dublin, CA 94568","$115,764 - $120,000 a year","Patelco Credit Union is a not-for-profit credit union with a purpose to build financial health and wellbeing for our members.",,"https://www.indeed.com/pagead/clk?mo=r&ad=-6NYlbfkN0D-xS4Sy9TnlfI1cdM-zzNdsPoAc9-QPgCXFDA_qNolh9U_S-vityo1zhZnlZlIgycQc5qVi7e5Dtov-NblEkLBi6PvshJRHbB2av0Jmr2gL8j-sIWfNh2cdvBN0WmwKuY8XGODNJ7p7dO0G8E_wxf-wqC1umdzKl8IWqDManmavnmKpM_ZiL-oZ2Z2Op22rc4OyBps5X5QGo-0U48mZ0hbzJMIWb2tmqDgrLmkwipTCp2WW2K12tkg_HMl0NEACjbjC6uzCE-80_6P9zi0JxUxetKA4oAGZoPbyH91ao6W6Ur5vHHbc1Enb1Fvp89tk9mELfZrqrEtljIJD1VfrdinIUBK6gLan75yGdzlJAcdWVqfhvJSzLRKxMy8OBNXp1JykHj7GILBB-37LuUni7QaNJQDKAyC_IoxzVbuKax0T7SjfkDxhTmVZEeVZYbTogI02dggSykND1-EQBl2opmp35pSrwkIQEnwx8HBU5ILAsFwzmfLgxj5gVvA6gSAk5cE-6LzI8w53kIiqBJQ1FfyuiK--tA7YNLYNKkajuAXi1U93biWF_S6QV-owt5HI_keMzLGivSv-fT46DseXBzvr7kzkgufdpgT1oDo3fNYPESXvDTXIjCQmaksFahRMpwQx3UKWsRFsLxa8XbN0Mr-eZJpysxJrc14ApwySCXUCvrK66memufnQwNWcrhA8aCV2DNOk-Rn0OGCE-JNvB-WNJSLoZsFRnq766KAYaOPfhdmGCSGf4MepF7boX9AXRXK90MeZeago3_dz2fg-D6lpb_S04NKpH6RD3OG-vcF1zHGS0KNgnBe17N4NZEdgJ_Hae7bSNiPo7c8sIgsLIeCuS1KDQb2lpsMWpSEoakS-V-OLjr7swjowLwRG2DFSW0sMCvTOKtnLX60zpbRUfFe9RAIciHLbkH3cx7rDUgt6YBMG2f5SEagbvdmIcKHRRAp_2_Ah02qLHrjMAPCkM7iMfD8nW04y3rPAX5cz95-NXmUwR4CF914Ch6gKE2JKcBCN2KIFrYEMQ==&xkcb=SoA86_M39QgEpPw2050HbzkdCdPP&camk=YU1lDJX-4XElP3ky6-9PIA==&p=12&fvj=0&vjs=3"
14,"Senior Data Scientist","Amazee Global Ventures Inc","Dallas, TX",,"Skilled in creating clear, data-driven presentations and reports suitable for both technical and non-technical stakeholders.
PAY RATE- 55 to 60$/ HOUR ON W2*.","Employer
Active 4 days ago","https://www.indeed.com/rc/clk?jk=1d185434ecff33f2&bb=XXPpoFVwJuShmV2H6BQMPwH3XF1qN_x_TyonUI9n6D9pR1yF5jzULE0lDly0JUzULmZrwzNxBgZn0QbgGskItZLR-TjAsQWsgGpKeEwNIBTI8xjPxqOsfjZ_dIyzqF93&xkcb=SoB867M39QgEpPw2050GbzkdCdPP&fccid=054e81f1e5e894b9&cmp=Amazee-Global-Ventures&ti=Senior+Data+Scientist&vjs=3"
15,"Scientist, Data Science Analytics & Insights","Johnson & Johnson","Titusville, NJ",,"Demonstrate emerging scientific and technological developments to generate new research ideas, solutions and initiatives using RWD including but not limited to…",,"https://www.indeed.com/rc/clk?jk=e1714afb1b42bfbc&bb=XXPpoFVwJuShmV2H6BQMP9LJxrE5xjdn1QWExCkQ1JvnaC2j5COwtRkvmxcXCyhed_plPRuTb-Nuxb4YsqJctOxDlHLmxSIsczfmrI4vkmruwuVDLs07g1UGFlOtOpSr&xkcb=SoDh67M39QgEpPw2050FbzkdCdPP&fccid=0bed8e17bc113980&vjs=3"
16,"DATA SCIENTIST","TriHealth","Cincinnati, OH",,"Analyze and model structured as well as semi structured data and implement algorithms to support analysis using statistical methods from statistics, machine…",,"https://www.indeed.com/rc/clk?jk=ba77d2dbf2ce3af1&bb=sxOnV6pfw48jKWs4G3DltQNCRYyauek-pXTJPprXhAKKJHb9iWNfZg3EobAIk4lWDPoDxgkj3YaoJvDlqDfbUCl4YqzwxfWN-Y0RDhxLoDViiK7WCZRAo34DPWRNXFQy&xkcb=SoDy67M39QgD5lw36J0LbzkdCdPP&fccid=ad532ca170730fd4&vjs=3"
17,"Data Scientist","Northwestern Medicine","Chicago, IL 60611 
(Streeterville area)",,"The data engineers/scientists use their broad knowledge of applied mathematics and statistics to create new algorithms to interpret, manipulate, and derive…",,"https://www.indeed.com/rc/clk?jk=8cb757bd03153632&bb=sxOnV6pfw48jKWs4G3DltX4IOzq7zGdxYKP6uaIu15kKVUs8v1KOy4Pn_TalaIMrBhSSPdchlg6ODVADRemnMkAZXsVQucHNpcYWzENRn_F24i4-ZLf6EbMaw1rFPZH5&xkcb=SoBG67M39QgD5lw36J0KbzkdCdPP&fccid=388ffa8e9601f976&vjs=3"
18,"Data Scientist","Johnson & Johnson","Titusville, NJ",,"In this role you will be someone who stays on the cutting edge of artificial intelligence, data science, and advanced analytics research through novel project…",,"https://www.indeed.com/rc/clk?jk=baaa822d0fc6f3d4&bb=sxOnV6pfw48jKWs4G3DltbYdiV2RxdBD_wVVMIP5V4YK6DPAxav7mFyBoCNw3Nc3I_IZyCZMiUkHOLaXbb4U_WWJ-5xFQ4q3RSRf8DHNjmHVyS-D56GKhU2PF9RcJxHo&xkcb=SoDb67M39QgD5lw36J0JbzkdCdPP&fccid=0bed8e17bc113980&vjs=3"
19,"Data Scientist (contract)","JnJ","Raritan, NJ",,"This role will provide support for the manufacturing science and technology team supporting a new clinical/commercial manufacturing site.",,"https://www.indeed.com/rc/clk?jk=98ba48d52b95be58&bb=sxOnV6pfw48jKWs4G3DltStSdpqO3LKAkTu5e11VuXxu8PusLLf5CuZA3yHATlWAWEpboHYpw4YXgaX8q28fDT_uWN17fCG8CiTtn4kP63yQJBllf11v_JSRUFhodSnJ&xkcb=SoBv67M39QgD5lw36J0IbzkdCdPP&fccid=0bed8e17bc113980&vjs=3"
20,"Data Scientist I","Kandu Health","Hybrid work in Campbell, CA 95008",,"Collaborate closely with research and clinical collaborator team to understand the data and the insights it brings.
Quality of life directly impacts health.",,"https://www.indeed.com/rc/clk?jk=795023c034e63796&bb=sxOnV6pfw48jKWs4G3Dltc2i6_HO4rXhygnuMDjqx3n1IlsUwA49RCxn0mCSqj3PeuINW9KQHS4Yk_iV-GFAfjJG02p2rd-NfuE3qZRIGUYmEgStWcmAl7L5bHMC6E5S&xkcb=SoDh67M39QgD5lw36J0PbzkdCdPP&fccid=dd616958bd9ddc12&vjs=3"
21,"Data Scientist- Load Forecasting","Xcel Energy","Denver, CO 80202 
(Union Station area)","$105,200 - $150,000 a year","This position is eligible for the following benefits: Annual Incentive Program, Medical/Pharmacy Plan, Dental, Vision, Life Insurance, Dependent Care…",,"https://www.indeed.com/rc/clk?jk=1fd06b5568c4e627&bb=sxOnV6pfw48jKWs4G3DltfxxHTwA_jRswOkKUGZ-qR3riav1UAtPPznUEhF_KGDaZJgE0DoufcuOMMeVgYERRPMxzwPHrvdwRWq28BrulQ2Q4grm69bFEQ%3D%3D&xkcb=SoBV67M39QgD5lw36J0ObzkdCdPP&fccid=0b3490f8005058ec&vjs=3"
22,"Clinical Data Scientist","IQVIA","Remote",,"Collaborate with other scientists and engineers to leverage machine learning methods and algorithms for modeling and analysis of clinical operations and…",,"https://www.indeed.com/rc/clk?jk=e45e0ec028e3dbb7&bb=sxOnV6pfw48jKWs4G3DltV8qbZ2BcKQiNhYLwHW99SI4wE6IgbLKZIeZo3l2Lc3sfjno6Eqaggn-_Txu7ffGDH_Sdjg92OV8Eo63yTEfryNwoW8odBBxgI2_-PtRlIfI&xkcb=SoDI67M39QgD5lw36J0NbzkdCdPP&fccid=6b7a1dfe07e7f037&vjs=3"
23,"Data Scientist","Cognizant","Remote in Missouri","$80,000 - $150,000 a year","This position is also eligible for Cognizant’s discretionary annual incentive program and stock awards, based on performance and is subject to the terms of…",,"https://www.indeed.com/rc/clk?jk=7f6039ca6056e06f&bb=sxOnV6pfw48jKWs4G3DlteKoMmTLZaHd2eaEYz2Va2Tk1aCgGoOnvgwNsloADyEFTiixVnIx-2TGpMmmBuF8mvxWUMa7p6QQgiE24oVY6szGh0QB6QDGCV705X_7kMa4&xkcb=SoB867M39QgD5lw36J0MbzkdCdPP&fccid=2df6a1e69a70a1e7&vjs=3"
24,"Data Scientist","Adobe","Seattle, WA 98103 
(Fremont area)","$107,900 - $192,300 a year","Your primary focus will be to develop and maintain a robust data architecture to advance our reporting, analytics, and experimentation capabilities, and on a…",,"https://www.indeed.com/rc/clk?jk=de30cfd486351197&bb=sxOnV6pfw48jKWs4G3DltbY2B2v8_xDN5zuyHXE6edHbpXQjRFRsvFiCKnwTzgF5WtmFxarnlt8RWM1xBb0hABKs4pj4LqVDRNK8sFbWI61XRmbCa4FJGw%3D%3D&xkcb=SoCV67M39QgD5lw36J0DbzkdCdPP&fccid=f89deb5a97c7738a&vjs=3"
25,"Lead Data Scientist","Amazee Global Ventures Inc","Atlanta, GA",,"A solid understanding of machine learning and deep learning techniques, particularly those relevant to natural language processing tasks such as text extraction…","Employer
Active 3 days ago","https://www.indeed.com/rc/clk?jk=42b1e50a43ad32a8&bb=sxOnV6pfw48jKWs4G3DlteaE7Kde2jBJ1zFpFKk4MYgRQZ9cQRADgQvEXggA-zddXRt0cN6GJ299IrRT996igCHa_JZucCCg4yN3fhC20d_AvrsENWltLJ4LbP5CdMWY&xkcb=SoAh67M39QgD5lw36J0CbzkdCdPP&fccid=054e81f1e5e894b9&cmp=Amazee-Global-Ventures&ti=Lead+Data+Scientist&vjs=3"
26,"Associate Data Scientist","The Standard","Remote in Portland, OR",,"Experienced with foundational Data Science and AI concepts such as data manipulation, machine learning algorithms, and model analysis.",,"https://www.indeed.com/rc/clk?jk=0ac4e7a84594b55e&bb=sxOnV6pfw48jKWs4G3DltU3LrPk30zMFL6N6Cd7K23W2Q-G9Nz4Xe0iQbU6A60UphXbkbkvS8JPBG-gBJLLtefChYts3ba8wr9lQGoTsuHBu1GWEYhU_r4uxBmREyblu&xkcb=SoC867M39QgD5lw36J0BbzkdCdPP&fccid=987bded2d477dc2b&vjs=3"
27,"Data Scientist","General Motors","Warren, MI",,"As a data scientist, you will be responsible for working with a cross functional team of data scientists, developers and data engineers seeking to solve GM's…",,"https://www.indeed.com/rc/clk?jk=760ca80f13aa2b7a&bb=sxOnV6pfw48jKWs4G3DltR-xRjrogK7EA_n9ZkLCVZrGLgg_YScEkPW5fDKzcbRD8fNU-djzYlRDpzK0a1AxYXBPOY_JNMsyQWvkRiCJy5ZHBxflg37Yyg%3D%3D&xkcb=SoAI67M39QgD5lw36J0AbzkdCdPP&fccid=116680a29a847a70&vjs=3"
28,"Sr Data Scientist","HCSC","Hybrid work in Chicago, IL","$88,700 - $160,200 a year","Senior data scientists collect, integrate and analyze data from sources related to health status and outcomes for our members, characteristics of health care…",,"https://www.indeed.com/rc/clk?jk=6a49398e0a744901&bb=sxOnV6pfw48jKWs4G3DltQIB60x93aWoN_4M2lrgrLOR8pqKLVaecxfpd-lkx53WmsVY1J_hPny17CBnRGjtxmWUQ7ob_rtGcVoL05l_DcT1IkNnXdu_OQ%3D%3D&xkcb=SoCG67M39QgD5lw36J0HbzkdCdPP&fccid=f0982fe98d8ebba0&vjs=3"
29,"Associate Data Scientist, RWE Clinical Trials Remote","WALGREENS","Remote in Deerfield, IL 60015",,"Experience working on alternative data sources and alternative methods of clinical data collection, especially those enabled by technology platforms and/or…",,"https://www.indeed.com/rc/clk?jk=0535c1945f4f3dc7&bb=sxOnV6pfw48jKWs4G3DltSyhUYWtjTQN5_vxBJggvcOm2gWsI4ub_9WAmsKwgELrYEEDm5_G-z_QUVeDdFW04ROeLE9XkvAr36AWgUPS6tVRjby9wK77sA%3D%3D&xkcb=SoAy67M39QgD5lw36J0GbzkdCdPP&fccid=fefd75f5326e1589&vjs=3"
30,"Data Scientist","Magna International Inc.","Troy, MI 48083",,"Support development of data analytics projects, apply data science, analytics, and computer vision to solve challenges in the manufacturing environment.",,"https://www.indeed.com/rc/clk?jk=56856db72f096be6&bb=sxOnV6pfw48jKWs4G3DltVHXP9Fn_n-hkY7_FGKEc-J84-pWCuMUSHvd1U2FSOMMnoEmlS-jgiRGogPNM8fJQ1Yfl7EgCXZOOxLwKHdunvXYr3xokN_uk-lmRNtaGGsi&xkcb=SoCv67M39QgD5lw36J0FbzkdCdPP&fccid=254ad00cf333484f&vjs=3"
31,"Data Scientist","IT Consulting Services","Pennsylvania",,"Clean and manipulate raw data using statistical software for better and more efficient health data and aid innovations in the pharmaceutical industry.",,"https://www.indeed.com/rc/clk?jk=6b3a737907d0d935&bb=Ta2QNd0XKIzG4SAT2jzt0XLkMnUBrZY3erBj7z0DIX5g6h-5u23_iHuwuSwRXv_Vy5ShLgCk8Z-PZd60lwVO8vTx3X1MOfSdH7raRTKUZ898q9S4EzRX2Yz_48-Gw-VF&xkcb=SoA367M39QgDA8yRTx0LbzkdCdPP&fccid=bb0f3a7bae7542f8&vjs=3"
32,"Senior Data Scientist","The J. M. Smucker Company","Remote",,"Become a subject matter expert and trusted adviser in data science.
Build advanced quantitative / statistical / machine learning algorithms and perform analyses…",,"https://www.indeed.com/rc/clk?jk=4a678c8482f876d0&bb=Ta2QNd0XKIzG4SAT2jzt0UA1PFppLLvqNyY3YOJgyrA0bWnRknuOStURWtNJTclIUi_EpuBFZiQ-2DIKKi0TLaWA1WCVeWgaz6di8PLQ8QHmSY10YFEqlw%3D%3D&xkcb=SoCD67M39QgDA8yRTx0KbzkdCdPP&fccid=a21694cd29ba9002&vjs=3"
33,"Data Scientist - P3","Boston Scientific Corporation","Hybrid work in Marlborough, MA 01752",,"As a Data Scientist, you will work closely with senior data scientists and engineers to help leverage data analytics to drive insights, inform decision-making…",,"https://www.indeed.com/rc/clk?jk=cfc70407998f556c&bb=Ta2QNd0XKIzG4SAT2jzt0SlqnLtqNet1rAylI1BanOFxhdZwW82T1H0W1XXjuCFLe2PC-dDXy-3ow--a8HzpcYjSOAMRuRSHk55C-rdGvuKGBCIRVc7xeA%3D%3D&xkcb=SoAe67M39QgDA8yRTx0JbzkdCdPP&fccid=d13187a50c252e33&vjs=3"
34,"Data Scientist","Stanford University","Remote in Stanford, CA",,"PhD or advanced degree in a relevant area (e.g., statistics, economics, operations research, computer science) or 5+ years of relevant work experience in data…",,"https://www.indeed.com/rc/clk?jk=0559c5621f19d231&bb=Ta2QNd0XKIzG4SAT2jzt0ZcuAbssyKXp_3d6KsFWk5R1Ep2C5PrzNgSouSbwAVgjNjpaMLVXkhY1Fr63K-WkGYfGSCAhwAVK4FQ1h531YaGBpo9FspFCvg%3D%3D&xkcb=SoCq67M39QgDA8yRTx0IbzkdCdPP&fccid=1ba7f338730ce720&vjs=3"
35,"Data Scientist - Remote India","LeewayHertz","Remote in San Francisco, CA 94111",,"2+ years of experience in data science, machine learning, and AI, with a focus on Generative AI.
In this role, you will develop and implement cutting-edge…",,"https://www.indeed.com/rc/clk?jk=6d4080ae02023d87&bb=Ta2QNd0XKIzG4SAT2jzt0ZKHo8vyh8atdGZ1dKAmUexNLU2o3kQxxklk28XqcAyKZJsPTD2kwoVMyzhQ1Hqz6SW_JvRBL6nzrpjoO59atzimG65tWErNQERxGn2_TPFS&xkcb=SoAk67M39QgDA8yRTx0PbzkdCdPP&fccid=67c1c701fe4bb3db&vjs=3"
36,"Sr. Data Scientist","Alight","Remote in Chicago, IL 60606","$82,000 - $130,100 a year","Your responsibilities include leading end-to-end machine learning projects, adhering to scientific best practices, and collaborating with stakeholders to align…",,"https://www.indeed.com/rc/clk?jk=314d66517764780a&bb=Ta2QNd0XKIzG4SAT2jzt0U9yv9NMUbHJGWYeQ4V2jwNRQFBuLs1SCUMwNpomLQiU3UbElwfjr2rMCqD7q1XT-jDinp6noNzweF9Ohb7qIWsVwleDmnVl3kyO9-OIMa4E&xkcb=SoCQ67M39QgDA8yRTx0ObzkdCdPP&fccid=c35833abe06c86e0&vjs=3"
37,"Data Engineer","Greystones Consulting Group LLC","Washington, DC 20003 
(Capitol Hill area)","$135,000 - $170,000 a year","Work with data scientists and functional resources to build tables as required to support procurement data within the building of applications.",,"https://www.indeed.com/rc/clk?jk=d31a1401fc105fae&bb=Ta2QNd0XKIzG4SAT2jzt0VMaxJC9qJY-2Pl03_5Irkoigi5ut2LJuC01k9gC_sLegDx1Gn4DldYzOUo00ZHT_QjslWTy95KTJCG7uaFZFwQnQizIjvfhOD8MQut7FAG8&xkcb=SoAN67M39QgDA8yRTx0NbzkdCdPP&fccid=c217704cc373c1dc&vjs=3"
38,"Data Scientist","Michelin","Woodburn, IN",,"Determining the relevant data among those available and identifying the missing data to acquire.
Data visualization to help create models to represent data and…",,"https://www.indeed.com/rc/clk?jk=12ec91f1ad3083f8&bb=Ta2QNd0XKIzG4SAT2jzt0SG_zKgb1g0m_jvEpSMD1yAo6VEnYz5Z7U_FztDb2aW6hk_FyFAr8B3NhHosb44P5B8_xu1ZnYKKgYhlq8sSRwzA61LjudujlZt2FqUZ0mJu&xkcb=SoC567M39QgDA8yRTx0MbzkdCdPP&fccid=8a90a0ee1d8ff04d&vjs=3"
39,"Data Scientist","State of Ohio Jobs","Columbus, OH",,"Utilizing analytics techniques (e.g. regression, correlation, cluster analysis, data quality, classification, data mining, machine learning, data visualization)…",,"https://www.indeed.com/rc/clk?jk=08353e0615c43f48&bb=Ta2QNd0XKIzG4SAT2jzt0XPlH523KMc5LymuPvCyQqwgD_gWMCixkTCmP7IpQXwSVRN8R-D7Z6Q2MS610VlwQMMCH05H0mOuK9SNOJPlQRH9Wg3r4R9zk2nycJhaKBwy&xkcb=SoBQ67M39QgDA8yRTx0DbzkdCdPP&fccid=adab04218ef837d0&vjs=3"
40,"Sr. Data Scientist","Hach","Loveland, CO 80538",,"5+ years' experience as a data scientist, data analyst, or data engineer.
From harvesting and schema design to machine learning products and decision support,…",,"https://www.indeed.com/rc/clk?jk=0cba648cfda7088e&bb=Ta2QNd0XKIzG4SAT2jzt0dVTzsKaL3Lc5gtiYhPuOQTEvAmNIANQsAwrer1EmtSSbaZ2zeX62HbcIH4KDKQiTjlztQWxibJBLBSHkESN-w40debdi0QNjMvbDglLfhFI&xkcb=SoDk67M39QgDA8yRTx0CbzkdCdPP&fccid=7211d6a9510d11db&vjs=3"
41,"DATA SCIENTIST ASSOCIATE","University of Alabama at Birmingham","Birmingham, AL",,"The ideal candidate will be familiar with clinical study documentation medical terminology appropriate for the division.",,"https://www.indeed.com/rc/clk?jk=da9dd5b6dad3ca48&bb=Ta2QNd0XKIzG4SAT2jzt0S-5ciMKZBhB5pA8IIvnj8bCNfdGozarRJw_n4YQXesHUdtGX-nxWMKHMOPBDvl7GXfyoGIri0UdKT7M9ersNPV_-AZAlN0_nw%3D%3D&xkcb=SoB567M39QgDA8yRTx0BbzkdCdPP&fccid=61b32dc36af3abe6&vjs=3"
42,"Lead Machine Learning Engineer, Bank Tech","Capital One","Hybrid work in McLean, VA 22101",,"Capital One will consider for employment qualified applicants with a criminal history in a manner consistent with the requirements of applicable laws regarding…",,"https://www.indeed.com/pagead/clk?mo=r&ad=-6NYlbfkN0C3j_zLGvpMLCdiZ0WC46XqVTA1VMZzOzKXPhAXwYlrNUFMD4PZ3AunGrII_Xzx8fFADRBtjbMjrTX9onHtHSPiSBJdybLIEahRkN4SwgsNbDFD7Q0kYBxxL92x-aTyen-LQJFVBxkedvVMLstopGu-nI_hQdbm_7WEUl4PwC3pd5n6Pi-MR0TGrNy4J83OV_8bPsOlHYd7GM_XryFYhNnUXOe7TJxzQqfNwi6W3CgrL_-NAQV1bWyD2uQCSxYJqZCicMpbYjBiuZUpF3RdwYHJeZATk-webmvj0UgAr6DFr5tLcdo6psH7fYkufF1Eu2n-XedEHd3X7fz4qKLzR-FnkAlXC7EE7ZOESUbYoizduKUEwXyx3dyXDArbrysbkol-UY3qZm981GQGENpmU083b8U4l9f9p97x-GYj3MGfX19WjCnWIMHhmHLYZXXYi9KnuAdmzBOcxZg8T66er37Y0ZDdLGtt2h6sKlOkEph_MGfw0y-5zRzGp0gRgAjbEJxT4ln1iilOM8g9j81vwFozki1KNmkKbj7NLoLrZpkesJKAUwwRLFjYx4WHR62ZnbzR7DbDzFAbEIo5XbzAFmGCzTbRYTD0XV7EAT1_yfqobGhwzCcqyNh-oJTVPy-ozbS7Hc8EcKUzMQ25Hv_R7AjtNb55v0JVrQf_Wue6kTFmNJc9lT7odsaQhGL-przvouApTWsT3AGRuxTy_WzG3bSNs6bzmNUwRaxaWBvGqdYosOW6mVPTgrmeCazo0WfYjsnqt3_Na6ZCBDYIbXSbGm-Fn1chTNXouBEPlYUn1CrHDfmE4myp4JcqDyz1l7KvUo7eGKSVnsjfgQ==&xkcb=SoA56_M39QgDA8yRTx0AbzkdCdPP&camk=4HOcmqOLYrAY9i7xfdbs4A==&p=11&fvj=0&vjs=3"
43,"Data Scientist","eBay","Remote in San Jose, CA 95125","$114,800 - $176,550 a year","Work with cross-functional partners to Influence product strategy and investment decisions with data driven insights and recommendations, be focused on impact,…",,"https://www.indeed.com/rc/clk?jk=b36658b24e72786a&bb=Ta2QNd0XKIzG4SAT2jzt0aba46IiW5UFHFFjs72LGfPLONVz0bt_fEcN-cunFnBKRjab8xKUE5XM2emO2N5_yG3mgpwU-zlGY2Fhrw7yQ1H58wHTKir2wg%3D%3D&xkcb=SoBD67M39QgDA8yRTx0HbzkdCdPP&fccid=ccf155b8e5eb4bf8&vjs=3"
44,"Data Scientist II - Anesthesiology","UTHealth Houston","Texas",,"Supports faculty and clinical, business and research customers with data science services on a variety of projects which may include clinical operations,…",,"https://www.indeed.com/rc/clk?jk=2f9d420e709a8b5c&bb=Ta2QNd0XKIzG4SAT2jzt0UIjjGtglkJGMAuAif_-pDOZ_nS_e2X-ecxRYfw6iMJGHqbP8bt5C-j9oJucYLJEktxrGVPICJ0ZcYxP1uunUVzfkodyy7GWIA%3D%3D&xkcb=SoD367M39QgDA8yRTx0GbzkdCdPP&fccid=2259246cd8a35c6c&vjs=3"
45,"Senior Data Scientist","Kikoff","San Francisco, CA",,"May lead/mentor junior data scientists.
Expert knowledge of data analytics and modeling using SQL, Python and machine learning/analytical packages.",,"https://www.indeed.com/rc/clk?jk=cfc333eb1c181dcb&bb=Ta2QNd0XKIzG4SAT2jzt0RczFo3I9VPVioA21Sv_XpjCLZhujvXd0SNLY71I0ol5L-OTS-FJSvP8W1VzRdx-SznTMJr55NCudY3-k9BQTMLa-WUJCeQvn7Z6oMAYsYcp&xkcb=SoBq67M39QgDA8yRTx0FbzkdCdPP&fccid=32227046f4a45298&vjs=3"
